{
  "$schema": "../../../schema/paquete.schema.json",
  "id": "rm-tobillo-pie-gorbachova2020",
  "titulo": "Resonancia Magnética de Tobillo y Pie",
  "descripcion": "Revisión de anatomía y patología común en RM de tobillo y pie.",
  "segmento": "musculoesqueletico",
  "modalidades": [
    "RM"
  ],
  "idioma": "es",
  "version": "0.2.0",
  "personas": {
    "pluna": "Pavel Luna"
  },
  "imagenes": {
    "fig01": {
      "archivo": "fig01.jpg",
      "fuente": "gorbachova2020",
      "figura": "Figure 1",
      "leyenda_original": "Subchondral insufficiency fracture of the talar head in a 64-year-old woman presenting with foot pain for several weeks without history of trauma. Sagittal T1-weighted (A) and short TI inversion recovery (B) magnetic resonance images demonstrate a prominent bone marrow edema-like signal at the talar head and neck (asterisk in b) that extends from the articular surface and an irregular hypointense fracture line (arrowhead A,B) that runs parallel and in close proximity to the subchondral bone plate",
      "modalidad": "RM",
      "paneles": [
        {
          "id": "A",
          "plano": "sagital",
          "secuencia": "T1",
          "condicion": null
        },
        {
          "id": "B",
          "plano": "sagital",
          "secuencia": "STIR",
          "condicion": null
        }
      ],
      "marcas": [
        {
          "marca": "asterisco",
          "panel": "B",
          "senala": "bone marrow edema-like signal at the talar head and neck"
        },
        {
          "marca": "cabeza de flecha",
          "panel": "A",
          "senala": "irregular hypointense fracture line"
        },
        {
          "marca": "cabeza de flecha",
          "panel": "B",
          "senala": "irregular hypointense fracture line"
        }
      ],
      "modificaciones": [
        "redimensionada",
        "comprimida"
      ],
      "drive": "1Ib-yfk65M_LvM5eSQVHKiGlDCGFy0eOZ"
    },
    "fig02": {
      "archivo": "fig02.jpg",
      "fuente": "gorbachova2020",
      "figura": "Figure 2",
      "leyenda_original": "Navicular stress fracture in an 18-year-old female athlete lacrosse player. Coronal fat-suppressed proton density weighted magnetic resonance image demonstrates an incomplete fracture line (arrow) that extends in the sagittal oblique plane through the midportion of the tarsal navicular bone dorsally amid an extensive bone marrow edema-like signal. This characteristic location often makes such fractures difficult to detect radiographically",
      "modalidad": "RM",
      "paneles": [
        {
          "id": "A",
          "plano": "coronal",
          "secuencia": "DP con supresión de grasa",
          "condicion": null
        }
      ],
      "marcas": [
        {
          "marca": "flecha",
          "panel": "A",
          "senala": "incomplete fracture line"
        }
      ],
      "modificaciones": [
        "redimensionada",
        "comprimida"
      ],
      "drive": "1MBtmucXDxIdYyC37MiqRS4pBi7z4D1mq"
    },
    "fig04": {
      "archivo": "fig04.jpg",
      "fuente": "gorbachova2020",
      "figura": "Figure 4",
      "leyenda_original": "Chronic osteochondral lesion of the talus in a 46-year-old woman with chronic ankle pain and no history of trauma. Coronal fat-suppressed proton-density-weighted magnetic resonance image depicts an irregularity of the articular cartilage and subchondral bone plate at the medial talar dome (arrow) with prominent underlying subchondral cyst-like changes. No osteochondral fragment in situ is visualized",
      "modalidad": "RM",
      "paneles": [
        {
          "id": "A",
          "plano": "coronal",
          "secuencia": "DP con supresión de grasa",
          "condicion": null
        }
      ],
      "marcas": [
        {
          "marca": "flecha",
          "panel": "A",
          "senala": "irregularity of the articular cartilage and subchondral bone plate"
        }
      ],
      "modificaciones": [
        "redimensionada",
        "comprimida"
      ],
      "drive": "15QB-7TbJKUMWuiBTeP_NRBGCqLRuvkFr"
    },
    "fig05": {
      "archivo": "fig05.jpg",
      "fuente": "gorbachova2020",
      "figura": "Figure 5",
      "leyenda_original": "Osteochondritis dissecans (OCD) of the medial talar dome in a 43-year-old woman. Coronal fat-suppressed proton-density-weighted magnetic resonance image demonstrates an osteochondral fragment in situ (arrow) at the medial talar dome. Note high signal intensity rim (white arrowhead) and small cyst-like changes (black arrowhead) at the interface between the fragment and parent bone; both these findings indicate instability in adult OCD",
      "modalidad": "RM",
      "paneles": [
        {
          "id": "A",
          "plano": "coronal",
          "secuencia": "DP con supresión de grasa",
          "condicion": null
        }
      ],
      "marcas": [
        {
          "marca": "flecha blanca",
          "panel": "A",
          "senala": "osteochondral fragment in situ"
        },
        {
          "marca": "cabeza de flecha blanca",
          "panel": "A",
          "senala": "high signal intensity rim"
        },
        {
          "marca": "cabeza de flecha negra",
          "panel": "A",
          "senala": "small cyst-like changes"
        }
      ],
      "modificaciones": [
        "redimensionada",
        "comprimida"
      ],
      "drive": "16YReXg8yEeBNM7qFgGR0VsZSdb01g32i"
    },
    "fig07": {
      "archivo": "fig07.jpg",
      "fuente": "gorbachova2020",
      "figura": "Figure 7",
      "leyenda_original": "Syndesmotic injury, aka “high ankle sprain”, in a 44-year-old woman who fell down the steps one month ago. Sequential axial fat-suppressed T2-weighted magnetic resonance images of the ankle demonstrate a tear of the inferior interosseous ligament (white arrow, A), complete tear of the anterior tibiofibular ligament (white curved arrow, B), sprain of the posterior tibiofibular ligament (black curved arrow, B) and sprain of the inferior transverse tibiofibular ligament (black arrow, C)",
      "modalidad": "RM",
      "paneles": [
        {
          "id": "A",
          "plano": "axial",
          "secuencia": "T2 con supresión de grasa",
          "condicion": null
        },
        {
          "id": "B",
          "plano": "axial",
          "secuencia": "T2 con supresión de grasa",
          "condicion": null
        },
        {
          "id": "C",
          "plano": "axial",
          "secuencia": "T2 con supresión de grasa",
          "condicion": null
        }
      ],
      "marcas": [
        {
          "marca": "flecha blanca",
          "panel": "A",
          "senala": "tear of the inferior interosseous ligament"
        },
        {
          "marca": "flecha curva blanca",
          "panel": "B",
          "senala": "complete tear of the anterior tibiofibular ligament"
        },
        {
          "marca": "flecha curva negra",
          "panel": "B",
          "senala": "sprain of the posterior tibiofibular ligament"
        },
        {
          "marca": "flecha negra",
          "panel": "C",
          "senala": "sprain of the inferior transverse tibiofibular ligament"
        }
      ],
      "modificaciones": [
        "redimensionada",
        "comprimida"
      ],
      "drive": "1rxp63ICt96EzHPwKNResFOscuADu7DoT"
    },
    "fig08": {
      "archivo": "fig08.jpg",
      "fuente": "gorbachova2020",
      "figura": "Figure 8",
      "leyenda_original": "Medial and lateral ligamentous injury in a 15-year-old boy injured playing basketball one day ago. Axial proton density weighted magnetic resonance images of the ankle demonstrate complete disruption of the anterior talofibular ligament (arrow, A). The calcaneofibular ligament is indistinct and edematous (arrow, B), consistent with a high-grade sprain. Note lax appearance of the torn superficial component of deltoid ligament (arrowhead in A)",
      "modalidad": "RM",
      "paneles": [
        {
          "id": "A",
          "plano": "axial",
          "secuencia": "DP",
          "condicion": null
        },
        {
          "id": "B",
          "plano": "axial",
          "secuencia": "DP",
          "condicion": null
        }
      ],
      "marcas": [
        {
          "marca": "flecha",
          "panel": "A",
          "senala": "complete disruption of the anterior talofibular ligament"
        },
        {
          "marca": "flecha",
          "panel": "B",
          "senala": "calcaneofibular ligament is indistinct and edematous"
        },
        {
          "marca": "cabeza de flecha",
          "panel": "A",
          "senala": "lax appearance of the torn superficial component of deltoid ligament"
        }
      ],
      "modificaciones": [
        "redimensionada",
        "comprimida"
      ],
      "drive": "1ithLe_GCzNInmVtrpZouDikz11kUA-1g"
    },
    "fig10": {
      "archivo": "fig10.jpg",
      "fuente": "gorbachova2020",
      "figura": "Figure 10",
      "leyenda_original": "Spectrum of Achilles tendon pathology. A) Sagittal short TI inversion recovery (STIR) magnetic resonance (MR) images of the ankle in a 68-year-old man, who heard and felt a pop in posterior ankle while playing tennis, demonstrates full-thickness Achilles tendon rupture with a fluid-filled gap (arrow) located 7 cm proximally to its calcaneal insertion. B) Sagittal STIR MR image in a 40-year-old woman with posterior heel pain for several months shows thickened Achilles tendon, consistent with tendinosis, and superimposed partial-thickness tear (arrow) at calcaneal insertion, associated with retrocalcaneal bursitis (black arrowhead), Achilles paratendinitis depicted as edema in the Kager’s fat pad (asterisk) and reactive osteitis of calcaneal tuberosity (white arrowhead)",
      "modalidad": "RM",
      "paneles": [
        {
          "id": "A",
          "plano": "sagital",
          "secuencia": "STIR",
          "condicion": null
        },
        {